<?xml version="1.0" encoding="UTF-8"?>
<!DOCTYPE RECH SYSTEM "rechnung.dtd">
<RECH>
	<RENR>8R</RENR>
	<RDAT>2017-12-29 00:00:00</RDAT>
	<KNR>1</KNR>
	<KNAME>Hans MÃ¼ller</KNAME>
	<PLZ>33575</PLZ>
	<ORT>Buschhausen</ORT>
	<Strasse>Baumallee</Strasse>
	<ARTNR>0</ARTNR>
	<ARTBEZ>H-Milch</ARTBEZ>
	<BMENGE>0</BMENGE>
	<ERBET>0.00</ERBET>
</RECH>